{
  "$schema": "http://json-schema.org/draft-07/schema#",
  "$id": "https://github.com/lasseflagstad/loop-kit/loop.config.schema.json",
  "title": "Loop Kit configuration",
  "description": "The single point of per-repo configuration for the Loop Kit. Nothing in the kit is hardcoded; every per-repo decision lives here.",
  "type": "object",
  "additionalProperties": false,
  "required": ["requiredChecks", "branchPrefix", "mergeMode"],
  "properties": {
    "$schema": {
      "type": "string",
      "description": "Optional path or URL to this schema."
    },
    "requiredChecks": {
      "type": "array",
      "description": "The name(s) of the CI status check(s) that form the green-gate. The gate requires ALL of these to have concluded success for the exact head SHA. Must be non-empty: a gate with no required checks would let everything through.",
      "minItems": 1,
      "items": { "type": "string", "minLength": 1 },
      "uniqueItems": true
    },
    "dangerousEdges": {
      "type": "array",
      "description": "Glob patterns for files whose modification makes a job human-gated. A job that touches any of these must be approved by a human before it ships.",
      "default": [],
      "items": { "type": "string", "minLength": 1 }
    },
    "branchPrefix": {
      "type": "string",
      "description": "Prefix for branches the runner creates, e.g. 'claude/'.",
      "default": "claude/",
      "minLength": 1
    },
    "notify": {
      "type": "object",
      "description": "One-way ping configuration for when the runner stops.",
      "additionalProperties": false,
      "default": { "channel": "none" },
      "required": ["channel"],
      "properties": {
        "channel": {
          "type": "string",
          "description": "Where to send the stop ping. 'none' disables notification.",
          "enum": ["none", "file", "webhook", "command"]
        },
        "target": {
          "type": "string",
          "description": "Channel-specific target: a file path (file), a URL (webhook), or a shell command template (command). Ignored for 'none'."
        }
      }
    },
    "mergeMode": {
      "type": "string",
      "description": "What the runner does after a green PR. 'auto-merge-on-green' squash-merges once the gate is green; 'tee-up' builds and leaves the PR for a human.",
      "enum": ["auto-merge-on-green", "tee-up"]
    },
    "decisions": {
      "type": "object",
      "description": "The two-way async decision surface. The loop can ask a yes/no question (approve a proposed job, or give a go-ahead on a human-gated one) and act on your reply on its next run. An approval never bypasses the merge-time human gate.",
      "additionalProperties": false,
      "properties": {
        "inbox": {
          "type": "string",
          "description": "Optional file the kit reads one-line replies from on its next run, one per line as '<decision-id> <answer>'. Omit it to answer only via the 'loop-decisions answer' command (or by editing the ledger).",
          "minLength": 1
        }
      }
    },
    "migrations": {
      "type": "object",
      "description": "Migration discipline configuration. Omit if the repo has no migrations.",
      "additionalProperties": false,
      "properties": {
        "dir": {
          "type": "string",
          "description": "Directory holding migration files, relative to the repo root.",
          "minLength": 1
        },
        "numberWidth": {
          "type": "integer",
          "description": "Zero-padded width of the central migration number prefix, e.g. 4 for 0001_*.",
          "minimum": 1,
          "default": 4
        }
      },
      "required": ["dir"]
    },
    "scout": {
      "type": "object",
      "description": "The scout: a read-only job-proposer that scans the repo and adds ranked, diff-checkable jobs to the queue as 'proposed'. Every field is optional; omitted fields use the scout's built-in defaults.",
      "additionalProperties": false,
      "properties": {
        "maxProposals": {
          "type": "integer",
          "description": "Maximum jobs the scout proposes per scan.",
          "minimum": 1,
          "default": 5
        },
        "checks": {
          "type": "object",
          "description": "Each scan check, toggleable. The two site checks default off; the rest default on.",
          "additionalProperties": false,
          "properties": {
            "emDash": {
              "type": "boolean",
              "description": "Flag em-dash characters (the kit forbids them).",
              "default": true
            },
            "todoMarkers": {
              "type": "boolean",
              "description": "Flag leftover TODO/FIXME markers in code.",
              "default": true
            },
            "testsForSources": {
              "type": "boolean",
              "description": "Flag source files with no matching test.",
              "default": true
            },
            "oversizedAssets": {
              "type": "boolean",
              "description": "Flag committed files over maxAssetBytes.",
              "default": true
            },
            "brokenInternalLinks": {
              "type": "boolean",
              "description": "Flag internal links that resolve to nothing. For repos that build a site.",
              "default": false
            },
            "missingMetaDescription": {
              "type": "boolean",
              "description": "Flag HTML pages with no meta description. For repos that build a site.",
              "default": false
            }
          }
        },
        "include": {
          "type": "array",
          "description": "Glob patterns for files to scan. Default: everything.",
          "items": { "type": "string", "minLength": 1 }
        },
        "exclude": {
          "type": "array",
          "description": "Glob patterns to skip (node_modules, build output, lockfiles, and so on).",
          "items": { "type": "string", "minLength": 1 }
        },
        "maxAssetBytes": {
          "type": "integer",
          "description": "A committed file larger than this (bytes) is flagged as an oversized asset.",
          "minimum": 1,
          "default": 512000
        },
        "sourceExtensions": {
          "type": "array",
          "description": "Extensions treated as source for the tests-for-sources check.",
          "items": { "type": "string", "minLength": 1 }
        },
        "commentScanExtensions": {
          "type": "array",
          "description": "Extensions scanned for TODO/FIXME markers (documentation is excluded by default).",
          "items": { "type": "string", "minLength": 1 }
        },
        "siteDir": {
          "type": ["string", "null"],
          "description": "When set, the site checks are scoped to this directory and '/'-rooted links resolve under it.",
          "minLength": 1
        }
      }
    }
  }
}
